{
  "$schema": "../schema.json",
  "id": "ephesians",
  "kind": "book",
  "status": "published",
  "slug": "ephesians",
  "title": "Ephesians",
  "pageTitle": "Ephesians Study Guide",
  "tagline": "God's Eternal Plan of Unity",
  "docTitle": "Ephesians: God's Eternal Plan - Interactive Bible Study",
  "metaDescription": "A free, in-depth study guide to Paul's letter to the Ephesians, with an eight week plan, Berean Study Bible passages and progress tracking.",
  "canon": {
    "testament": "new",
    "group": "Pauline epistles",
    "order": 10,
    "chapters": 6
  },
  "progressOpening": "Ready to discover God's eternal plan!",
  "units": [
    {
      "id": "overview",
      "navLabel": "Overview",
      "title": "Study Overview",
      "blocks": [
        {
          "type": "themes",
          "heading": "Purpose of This Study",
          "body": [
            {
              "p": "Welcome to an exploration of Paul's letter to the Ephesians! This profound epistle reveals God's eternal plan to unite all things in Christ. Through this interactive study, you'll discover the spiritual riches believers have in Christ and how to live out our heavenly calling in practical ways."
            }
          ]
        },
        {
          "type": "checklist",
          "heading": "Your Study Goals",
          "items": [
            {
              "id": "goal1",
              "text": "Understand God's eternal plan for unity in Christ"
            },
            {
              "id": "goal2",
              "text": "Grasp the spiritual blessings available to believers"
            },
            {
              "id": "goal3",
              "text": "Learn how to walk worthy of your calling"
            },
            {
              "id": "goal4",
              "text": "Apply principles of Christian unity and relationships"
            },
            {
              "id": "goal5",
              "text": "Understand spiritual warfare and put on God's armor"
            }
          ],
          "intro": "Check off each goal as you complete it:"
        },
        {
          "type": "toolgrid",
          "cards": [
            {
              "heading": "Study Method",
              "body": [
                {
                  "p": "We'll use the <strong>SOAP</strong> method:"
                },
                {
                  "ul": [
                    "<strong>S</strong>cripture - Read the text",
                    "<strong>O</strong>bservation - What does it say?",
                    "<strong>A</strong>pplication - How does it apply?",
                    "<strong>P</strong>rayer - Talk to God about it"
                  ]
                }
              ]
            },
            {
              "heading": "Time Commitment",
              "body": [
                {
                  "p": "Each chapter study is designed for:"
                },
                {
                  "ul": [
                    "30-45 minutes individual study",
                    "60-90 minutes group discussion",
                    "Weekly personal reflection"
                  ]
                }
              ]
            },
            {
              "heading": "Resources Needed",
              "body": [
                {
                  "ul": [
                    "Bible (multiple translations helpful)",
                    "Notebook for personal notes",
                    "This interactive guide",
                    "Open heart for God's Word!"
                  ]
                }
              ]
            }
          ]
        }
      ]
    },
    {
      "id": "schedule",
      "navLabel": "Schedule",
      "title": "Study Schedule",
      "blocks": [
        {
          "type": "themes",
          "heading": "8-Week Study Plan",
          "body": [
            {
              "p": "This comprehensive study of Ephesians is designed to be completed over 8 weeks, allowing time for deep reflection and application. Each week includes individual study time and group discussion."
            }
          ]
        },
        {
          "type": "toolgrid",
          "cards": [
            {
              "heading": "Week 1: Overview & Background",
              "body": [
                {
                  "p": "<strong>Focus:</strong> Understanding the context"
                },
                {
                  "ul": [
                    "Historical background of Ephesus",
                    "Paul's relationship with the church",
                    "Study goals and methodology"
                  ]
                }
              ]
            },
            {
              "heading": "Week 2: Chapter 1",
              "body": [
                {
                  "p": "<strong>Focus:</strong> Spiritual Blessings in Christ"
                },
                {
                  "ul": [
                    "God's eternal plan",
                    "Election and predestination",
                    "Sealed with the Holy Spirit"
                  ]
                }
              ]
            },
            {
              "heading": "Week 3: Chapter 2",
              "body": [
                {
                  "p": "<strong>Focus:</strong> Made Alive in Christ"
                },
                {
                  "ul": [
                    "From death to life",
                    "Salvation by grace through faith",
                    "Unity between Jews and Gentiles"
                  ]
                }
              ]
            },
            {
              "heading": "Week 4: Chapter 3",
              "body": [
                {
                  "p": "<strong>Focus:</strong> God's Eternal Purpose"
                },
                {
                  "ul": [
                    "Paul's ministry to Gentiles",
                    "Prayer for spiritual strength",
                    "God's immeasurable power"
                  ]
                }
              ]
            },
            {
              "heading": "Week 5: Chapter 4",
              "body": [
                {
                  "p": "<strong>Focus:</strong> Unity and Maturity"
                },
                {
                  "ul": [
                    "Unity in the body of Christ",
                    "Spiritual gifts for building up",
                    "New life vs. old life"
                  ]
                }
              ]
            },
            {
              "heading": "Week 6: Chapter 5",
              "body": [
                {
                  "p": "<strong>Focus:</strong> Walking in Love and Light"
                },
                {
                  "ul": [
                    "Imitating God and walking in love",
                    "Spirit-filled living",
                    "Christian relationships"
                  ]
                }
              ]
            },
            {
              "heading": "Week 7: Chapter 6",
              "body": [
                {
                  "p": "<strong>Focus:</strong> Spiritual Warfare"
                },
                {
                  "ul": [
                    "Family and work relationships",
                    "Reality of spiritual warfare",
                    "The full armor of God"
                  ]
                }
              ]
            },
            {
              "heading": "Week 8: Summary & Application",
              "body": [
                {
                  "p": "<strong>Focus:</strong> Living Out Ephesians"
                },
                {
                  "ul": [
                    "Key takeaways review",
                    "Personal application planning",
                    "Commitment to ongoing growth"
                  ]
                }
              ]
            }
          ]
        },
        {
          "type": "application",
          "heading": "Weekly Time Commitment",
          "body": [
            {
              "ul": [
                "<strong>Individual Study:</strong> 45-60 minutes per week",
                "<strong>Group Discussion:</strong> 90 minutes per week",
                "<strong>Personal Reflection:</strong> 15 minutes daily",
                "<strong>Scripture Memorization:</strong> 10 minutes daily"
              ]
            }
          ]
        },
        {
          "type": "checklist",
          "heading": "Schedule Preparation Checklist",
          "items": [
            {
              "id": "schedGoal1",
              "text": "Set aside dedicated study time each week"
            },
            {
              "id": "schedGoal2",
              "text": "Find or form a study group"
            },
            {
              "id": "schedGoal3",
              "text": "Gather necessary study materials"
            },
            {
              "id": "schedGoal4",
              "text": "Commit to the full 8-week journey"
            }
          ],
          "badge": {
            "id": "schedBadge",
            "text": "Schedule Set!"
          }
        }
      ]
    },
    {
      "id": "background",
      "navLabel": "Background",
      "title": "Historical Background",
      "blocks": [
        {
          "type": "context",
          "heading": "The City of Ephesus",
          "body": [
            {
              "p": "<strong>Location:</strong> Ephesus was the capital city of the Roman province of Asia (modern-day Turkey), strategically located on the Aegean Sea. It was one of the largest cities in the Roman Empire, with a population of around 250,000-500,000 people."
            },
            {
              "p": "<strong>Economic Status:</strong> A major commercial and trade center, Ephesus was incredibly wealthy. The city was famous for its magnificent harbor, extensive road systems, and as a center of banking and commerce."
            },
            {